,Group 1a,Group 1b,Group 2a,Group 2b,Group 3a,Group 3b
87,A better cabinet to stack books,Place to put bag,Connecting without having to go under table,A better cabinet to stack books,Get an extra screen space to work effectively,ergonomic neck/back alignment during computer use
88,"box transportation under desk (leaned down to pick it up off floor and move it under desk, discomfort?)",Laptop stand that raises screen to eye-level,"Organize desk with file tray, bookends, books, water bottle, stapler, pen holder",Untangling cords from other equipments,Maybe a desk organizer,Stationary organizer
89,All equipment necessary should be easy for the user to move and set up,"Some sticky notes maybe because the user likes to use them, or even a calendar/ task organizer;",monitor with front buttons;,Finding ports;,There are many unused objects that are in the way for the task,A better cabinet to stack books
90,to use the monitor as a second screen for an external laptop,Connect laptop/keyboard to display screen.,Access to power outlets for short cords,laptop stand,Connection between devices should be fast,Hold books so they are easy to see
91,Easier access to space beneath the desk for placing CPU.,easy access behind desk for faster computer station setup,lifting support to pick up items on floor,Place to put bag,the computer under the desk does not leave enough space for the user ti sit comfortably;,a desk to hold the items listed above
92,Trying to get the screen to work wihtouthassle,better way to store things on desk in order to promote ease of long-term organization;,more space on desk,monitor transportation onto desk (leaned down to pick it up off box and move it),Taking care of existing items that might needs to be moved away to accommodate their workspace (e.g. the blue buckets);,book organization (possibly to see all titles better than the horizontal orientation)
93,Possible backache?,easier connections for power and data,Learn how to operate the monitor,Setting up a workspace to get to work comfortably as soon as possible,Easier identification of power switch on display screen.,Have writing materials close by;
94,A chair/device that can help with grabbing things near the ground or being in a crouching position,backpack storage,unboxing/placing and organizing items onto desk (is this a regular activity?),The office materials could be kept closer to the height of the desk so that he can easily reach them,Two monitors,easily moveable desktop computer
95,A clear floor around the workstation,Setting up an office desk to get comfortable with their new workspace,"there is no designated place for the computer, he needs to look and decide where to put it",not enough space on desk,Easily accessible method for turning on monitor,"Organize desk with file tray, bookends, books, water bottle, stapler, pen holder"
96,monitor transportation onto desk (leaned down to pick it up off box and move it),Place for putting bags,a water bottle to stay hydrated throughout the day,Getting desk clean vs making it easy to connect things together,Easy connections,a chair to work
97,Findingwhere to plug in the cords,the computer under the desk does not leave enough space for the user ti sit comfortably;,book organization (possibly to see all titles better than the horizontal orientation),Adjustable monitor stand;,lifting support to pick up items on floor,cable organization
98,access to multiple power outlets near desk,Easily accessible method for turning on monitor,to find good screen setup (i.e. monitor and laptop placement),"Modular items for desk personalization (such as books, photos, etc.)","cable management - many cables, hard to find where to connect and make it comfortable",Routing cords around tables
99,Wider/larger desk space.,laptop stand,Get everything to work together seamlessly without too much hassle,"easier knowledge or where power button is for the monitor (putting hands on monitor, presumably to find power switch)",to limit equipment brought or utilize equipment more efficiently;,Wider/larger desk space.
100,"easier knowledge or where power button is for the monitor (putting hands on monitor, presumably to find power switch)",to make better use of desk space;,"Ergonomically-friendly storage of items (books, monitor, etc.) that avoids need to bend down;",help finding right buttons for their use,not enough space on desk,Having support to lift heavy objects e.g. computer case?
101,easier way to access monitor outlets;,lifting support to pick up items on floor,Long cables accessible in a neutral sitting or standing position,Connect the display screen to power outlet.,Connect the CPU to power and display screen.,access to under the desk (had to move the chair)
102,ergonomic office chair,power cord organization (untangling and unraveling cord),"box transportation under desk (leaned down to pick it up off floor and move it under desk, discomfort?)",Laptop stand that raises screen to eye-level,Findingwhere to plug in the cords,"Access to common office items (stapler, etc.)"
103,accessible ports on computer;,Taking care of existing items that might needs to be moved away to accommodate their workspace (e.g. the blue buckets);,usb cable hub,to place monitor on a bette position on the desk to avoid strain,easier way to access monitor outlets;,Finding on button for monitor
104,Ergonomic mousepad,Adjustable monitor stand;,Ergonomic mousepad,access to electricity,"a better distributed working space, including the desk and mini island adjacent to it",A mouse?
105,,Efficient packing of equipments from home/old workplace to the current one,,a keyboard as they seem to work a lot with online media,,Find and switch on the display screen.
